{
  "$schema": "https://schema.evideris.com/derived/schemas/competency.schema.json",
  "$id": "https://schema.evideris.com/derived/competency/poem-2/myotomy-technique.v1.0.0.json",
  "lineageId": "c-poem-2-myotomy-technique",
  "type": "competency",
  "version": "1.0.0",
  "release": "r2026.07",
  "supersedes": null,
  "supersededBy": null,
  "language": [
    "en"
  ],
  "modality": "m-poem",
  "kind": "procedural",
  "title": {
    "en": "Myotomy technique"
  },
  "description": {
    "en": "Cranial-to-caudal myotomy starting ≥2 cm below the mucosotomy site, extended 2–3 cm distal to the GEJ, tailored short vs long by disease type."
  },
  "milestones": [
    {
      "level": "novice",
      "criteria": {
        "en": "Requires prompting to execute; recognises the need for myotomy technique but cannot yet perform reliably."
      }
    },
    {
      "level": "competent",
      "criteria": {
        "en": "Performs myotomy technique independently to source-defined standards."
      }
    },
    {
      "level": "expert",
      "criteria": {
        "en": "Teaches myotomy technique to trainees; handles atypical/complex cases."
      }
    }
  ],
  "crossRefs": {
    "ukJag": [],
    "uemsCesma": []
  },
  "_meta": {
    "provenance": {
      "type": "evideris-design",
      "reason": "Atomic-skill decomposition of the source-canonical ESGE POEM 2025 Part II recommendations into trainee-assessable units. The POEM curriculum enumerates recommendations and the PPAT scores procedures; this competency frame is Evideris's design for portfolio-level tracking.",
      "derived_from": [
        "cur-poem-2-2025"
      ]
    },
    "encodedBy": "other:codex-source-fidelity-repair",
    "encodedAt": "2026-08-09"
  }
}
