{
  "$schema": "https://schema.evideris.com/derived/schemas/competency.schema.json",
  "$id": "https://schema.evideris.com/derived/competency/emr-cln/basic-colonoscopy-prereq.v1.0.0.json",
  "lineageId": "c-emr-cln-basic-colonoscopy-prereq",
  "type": "competency",
  "version": "1.0.0",
  "release": "r2026.07",
  "supersedes": null,
  "supersededBy": null,
  "language": [
    "en"
  ],
  "modality": "m-colonoscopy-emr",
  "kind": "procedural",
  "title": {
    "en": "Basic diagnostic colonoscopy (prerequisite)"
  },
  "description": {
    "en": "Achievement of nationally recognised basic competence in diagnostic colonoscopy as a precondition for EMR training (per Tate EMR 2023 Rec 1)."
  },
  "milestones": [
    {
      "level": "competent",
      "criteria": {
        "en": "Documented basic colonoscopy competence per national / training-programme standard."
      }
    }
  ],
  "qualityIndicatorRefs": [],
  "kpiRefs": [],
  "crossRefs": {
    "ukJag": [],
    "uemsCesma": []
  },
  "_meta": {
    "provenance": {
      "type": "evideris-design",
      "reason": "Atomic-skill decomposition of source-canonical ESGE EMR recommendations into trainee-assessable units. The recommendation is what ESGE publishes; the competency is what Evideris uses to score a trainee on. Not enumerated as objects in Tate EMR 2023; this competency frame is Evideris's design.",
      "derived_from": [
        "rec-emr-cln-r1-prereq-competencies",
        "cur-emr-colon-2023"
      ]
    },
    "encodedBy": "human:david",
    "encodedAt": "2026-06-28"
  }
}
