{
  "$schema": "https://schema.evideris.com/derived/schemas/competency.schema.json",
  "$id": "https://schema.evideris.com/derived/competency/poem-2/mucosotomy.v1.0.0.json",
  "lineageId": "c-poem-2-mucosotomy",
  "type": "competency",
  "version": "1.0.0",
  "release": "r2026.07",
  "supersedes": null,
  "supersededBy": null,
  "language": [
    "en"
  ],
  "modality": "m-poem",
  "kind": "procedural",
  "title": {
    "en": "Mucosotomy technique"
  },
  "description": {
    "en": "Initial mucosal incision at 45–80° with a cutting mode, extension by 1.5–2 cm cranial-to-caudal in the planned tunnel axis with minimum ESU taps."
  },
  "milestones": [
    {
      "level": "novice",
      "criteria": {
        "en": "Requires prompting to execute; recognises the need for mucosotomy technique but cannot yet perform reliably."
      }
    },
    {
      "level": "competent",
      "criteria": {
        "en": "Performs mucosotomy technique independently to source-defined standards."
      }
    },
    {
      "level": "expert",
      "criteria": {
        "en": "Teaches mucosotomy technique to trainees; handles atypical/complex cases."
      }
    }
  ],
  "crossRefs": {
    "ukJag": [],
    "uemsCesma": []
  },
  "_meta": {
    "provenance": {
      "type": "evideris-design",
      "reason": "Atomic-skill decomposition of the source-canonical ESGE POEM 2025 Part II recommendations into trainee-assessable units. The POEM curriculum enumerates recommendations and the PPAT scores procedures; this competency frame is Evideris's design for portfolio-level tracking.",
      "derived_from": [
        "rec-poem-2-r14-to-create-the-mucosotomy-the-first-incision-should-be-made",
        "cur-poem-2-2025"
      ]
    },
    "encodedBy": "other:codex-source-fidelity-repair",
    "encodedAt": "2026-08-09"
  }
}
