{
  "$schema": "https://schema.evideris.com/derived/schemas/competency.schema.json",
  "$id": "https://schema.evideris.com/derived/competency/emr-cln/submucosal-injection.v1.0.0.json",
  "lineageId": "c-emr-cln-submucosal-injection",
  "type": "competency",
  "version": "1.0.0",
  "release": "r2026.07",
  "supersedes": null,
  "supersededBy": null,
  "language": [
    "en"
  ],
  "modality": "m-colonoscopy-emr",
  "kind": "procedural",
  "title": {
    "en": "Submucosal injection technique"
  },
  "description": {
    "en": "Dynamic submucosal injection delivering a lifting cushion of appropriate solution to facilitate snare capture, with safe avoidance of injection through lesions suspected of containing submucosal invasive cancer."
  },
  "milestones": [
    {
      "level": "novice",
      "criteria": {
        "en": "Achieves a partial lift; needle position frequently incorrect."
      }
    },
    {
      "level": "competent",
      "criteria": {
        "en": "Consistent dynamic lift; tangential approach; recognises non-lifting sign; avoids injection through suspected SMI."
      },
      "expectedAtCases": 30
    },
    {
      "level": "expert",
      "criteria": {
        "en": "Teaches the technique; manages the non-lifting lesion; chooses injection solution by clinical context."
      }
    }
  ],
  "suggestedCaseload": 30,
  "qualityIndicatorRefs": [],
  "kpiRefs": [],
  "crossRefs": {
    "ukJag": [],
    "uemsCesma": []
  },
  "_meta": {
    "provenance": {
      "type": "evideris-design",
      "reason": "Atomic-skill decomposition of source-canonical ESGE EMR recommendations into trainee-assessable units. The recommendation is what ESGE publishes; the competency is what Evideris uses to score a trainee on. Not enumerated as objects in Tate EMR 2023; this competency frame is Evideris's design.",
      "derived_from": [
        "rec-emr-cln-r16-submucosal-injection-technique",
        "rec-emr-cln-r19-submucosal-injection-technique",
        "cur-emr-colon-2023"
      ]
    },
    "encodedBy": "human:david",
    "encodedAt": "2026-06-28"
  }
}
