{
  "$schema": "https://schema.evideris.com/derived/schemas/competency.schema.json",
  "$id": "https://schema.evideris.com/derived/competency/esd/emr-proficiency-prereq.v1.0.0.json",
  "lineageId": "c-esd-emr-proficiency-prereq",
  "type": "competency",
  "version": "1.0.0",
  "release": "r2026.07",
  "supersedes": null,
  "supersededBy": null,
  "language": [
    "en"
  ],
  "modality": "m-esd",
  "kind": "procedural",
  "title": {
    "en": "Proficiency in EMR (prerequisite)"
  },
  "description": {
    "en": "Documented competence in endoscopic mucosal resection \u2014 injection, snare placement, and management of intraprocedural adverse events. Prerequisite to any ESD training."
  },
  "milestones": [
    {
      "level": "novice",
      "criteria": {
        "en": "Requires prompting to execute; recognises the need for proficiency in emr (prerequisite) but cannot yet perform reliably."
      }
    },
    {
      "level": "competent",
      "criteria": {
        "en": "Performs proficiency in emr (prerequisite) independently to source-defined standards."
      },
      "expectedAtCases": 25
    },
    {
      "level": "expert",
      "criteria": {
        "en": "Teaches proficiency in emr (prerequisite) to trainees; handles atypical/complex cases."
      }
    }
  ],
  "crossRefs": {
    "ukJag": [],
    "uemsCesma": []
  },
  "_meta": {
    "provenance": {
      "type": "evideris-design",
      "reason": "Atomic-skill decomposition of source-canonical ESGE ESD 2019 recommendations into trainee-assessable units. ESD 2019 does not enumerate competencies as separate objects; this frame is Evideris's design.",
      "derived_from": [
        "rec-esd-r2-prior-training-required-emr-adverse-event-management",
        "cur-esd-2019"
      ]
    },
    "encodedBy": "human:david",
    "encodedAt": "2026-07-01"
  }
}
