{
  "$schema": "https://schema.evideris.com/derived/schemas/competency.schema.json",
  "$id": "https://schema.evideris.com/derived/competency/esd/supervised-first-human-esd.v1.0.0.json",
  "lineageId": "c-esd-supervised-first-human-esd",
  "type": "competency",
  "version": "1.0.0",
  "release": "r2026.07",
  "supersedes": null,
  "supersededBy": null,
  "language": [
    "en"
  ],
  "modality": "m-esd",
  "kind": "procedural",
  "title": {
    "en": "First 10 human ESD procedures under supervision"
  },
  "description": {
    "en": "Completion of the first 10 human ESD procedures under direct supervision by an ESD-proficient endoscopist."
  },
  "milestones": [
    {
      "level": "novice",
      "criteria": {
        "en": "Requires prompting to execute; recognises the need for first 10 human esd procedures under supervision but cannot yet perform reliably."
      }
    },
    {
      "level": "competent",
      "criteria": {
        "en": "Performs first 10 human esd procedures under supervision independently to source-defined standards."
      },
      "expectedAtCases": 25
    },
    {
      "level": "expert",
      "criteria": {
        "en": "Teaches first 10 human esd procedures under supervision to trainees; handles atypical/complex cases."
      }
    }
  ],
  "crossRefs": {
    "ukJag": [],
    "uemsCesma": []
  },
  "_meta": {
    "provenance": {
      "type": "evideris-design",
      "reason": "Atomic-skill decomposition of source-canonical ESGE ESD 2019 recommendations into trainee-assessable units. ESD 2019 does not enumerate competencies as separate objects; this frame is Evideris's design.",
      "derived_from": [
        "rec-esd-r10-first-10-human-procedures-under-supervision",
        "cur-esd-2019"
      ]
    },
    "encodedBy": "human:david",
    "encodedAt": "2026-07-01"
  }
}
