{
  "$schema": "https://schema.evideris.com/derived/schemas/competency.schema.json",
  "$id": "https://schema.evideris.com/derived/competency/esd/supervised-observation-assist.v1.0.0.json",
  "lineageId": "c-esd-supervised-observation-assist",
  "type": "competency",
  "version": "1.0.0",
  "release": "r2026.07",
  "supersedes": null,
  "supersededBy": null,
  "language": [
    "en"
  ],
  "modality": "m-esd",
  "kind": "procedural",
  "title": {
    "en": "Observation + assist under an expert"
  },
  "description": {
    "en": "Structured observation of \u226520 expert ESD procedures and assisting in \u22655 procedures at a tertiary referral centre before first human ESD as primary operator."
  },
  "milestones": [
    {
      "level": "novice",
      "criteria": {
        "en": "Requires prompting to execute; recognises the need for observation + assist under an expert but cannot yet perform reliably."
      }
    },
    {
      "level": "competent",
      "criteria": {
        "en": "Performs observation + assist under an expert independently to source-defined standards."
      },
      "expectedAtCases": 25
    },
    {
      "level": "expert",
      "criteria": {
        "en": "Teaches observation + assist under an expert to trainees; handles atypical/complex cases."
      }
    }
  ],
  "crossRefs": {
    "ukJag": [],
    "uemsCesma": []
  },
  "_meta": {
    "provenance": {
      "type": "evideris-design",
      "reason": "Atomic-skill decomposition of source-canonical ESGE ESD 2019 recommendations into trainee-assessable units. ESD 2019 does not enumerate competencies as separate objects; this frame is Evideris's design.",
      "derived_from": [
        "rec-esd-r8-observation-of-experts-20-procedures-5-as-assistant",
        "cur-esd-2019"
      ]
    },
    "encodedBy": "human:david",
    "encodedAt": "2026-07-01"
  }
}
