{
  "$schema": "https://schema.evideris.com/derived/schemas/competency.schema.json",
  "$id": "https://schema.evideris.com/derived/competency/emr-cln/snare-capture.v1.0.0.json",
  "lineageId": "c-emr-cln-snare-capture",
  "type": "competency",
  "version": "1.0.0",
  "release": "r2026.07",
  "supersedes": null,
  "supersededBy": null,
  "language": [
    "en"
  ],
  "modality": "m-colonoscopy-emr",
  "kind": "procedural",
  "title": {
    "en": "Snare placement, capture, and closure"
  },
  "description": {
    "en": "Selecting and positioning an appropriate snare, capturing target tissue with adequate margin and downward pressure with gas aspiration, and closing under direct vision."
  },
  "milestones": [
    {
      "level": "novice",
      "criteria": {
        "en": "Captures tissue inconsistently; requires verbal prompts."
      }
    },
    {
      "level": "competent",
      "criteria": {
        "en": "Independent capture with appropriate margin; snare V continuously visualised."
      },
      "expectedAtCases": 30
    },
    {
      "level": "expert",
      "criteria": {
        "en": "Adapts capture technique to lesion morphology and location; teaches the technique."
      }
    }
  ],
  "suggestedCaseload": 30,
  "qualityIndicatorRefs": [],
  "kpiRefs": [],
  "crossRefs": {
    "ukJag": [],
    "uemsCesma": []
  },
  "_meta": {
    "provenance": {
      "type": "evideris-design",
      "reason": "Atomic-skill decomposition of source-canonical ESGE EMR recommendations into trainee-assessable units. The recommendation is what ESGE publishes; the competency is what Evideris uses to score a trainee on. Not enumerated as objects in Tate EMR 2023; this competency frame is Evideris's design.",
      "derived_from": [
        "rec-emr-cln-r17-cold-snare-placement",
        "rec-emr-cln-r20-snare-placement-capture-and",
        "cur-emr-colon-2023"
      ]
    },
    "encodedBy": "human:david",
    "encodedAt": "2026-06-28"
  }
}
